### ISSUE TITLE
ffplay works, zoneminder doesn't - DCS-8526LH

### ISSUE THREAD

**Issue by chrisrd** [ZoneMinder/zoneminder#3194]
**Describe Your Environment**
- Version of ZoneMinder: 1.35.20~20210309163038-focal
- How you installed ZoneMinder: PPA
- Full name and version of OS: Ubuntu 20.04 focal
- Browser name and version: n/a

**If the issue concerns a camera**
- Make and Model: D-Link DCS-8526LH
- frame rate: 15 fps
- resolution: 1920x1080
- ZoneMinder Source Type: remote

**Describe the bug**
The camera plays using `ffplay`, e.g.:
```
$ ffplay -rtsp_transport tcp rtsp://admin:pin@ip:554/live/profile.0
Input #0, rtsp, from 'rtsp://admin:pin@ip:554/live/profile.0':
  Metadata:
    title           : Session streamed by D-Link
    comment         : live/profile.0
  Duration: N/A, start: 0.000000, bitrate: N/A
    Stream #0:0: Video: h264 (High), yuvj420p(pc, bt709, progressive), 1920x1080, 15 fps, 14.99 tbr, 90k tbn, 30 tbc
    Stream #0:1: Audio: aac (LC), 16000 Hz, mono, fltp
    Stream #0:2: Audio: opus, 48000 Hz, mono, fltp
[swscaler @ 0x7fe8b0676940] deprecated pixel format used, make sure you did set range correctly
[rtsp @ 0x7fe8d0000bc0] CSeq 7 expected, 0 received.
  36.82 A-V: -0.019 fd=   3 aq=    0KB vq=    0KB sq=    0B f=1/1
```

With the ZM monitor configured as:
```
General
  Source Type: Remote
  Function:  Monitor
Source
  Protocol: RTSP
  Method:  RTP/RTSP
  Host Name:  admin:pin@ip
  Port:  554
  Path:  /live/profile.0
  Capture Resolution (pixels):  1920x1080 1080p
```

The monitor doesn't play, and ZM logs:
```
03/11/21 09:19:29.561324 zmc_m10[2655335].DB2-zm_rtsp.cpp/43 [Sending RTSP message: PLAY rtsp://ispy:554/live/profile.0 RTSP/1.0
Session: AB7F5196
Range: npt=0.000-
Authorization: Digest username="admin", realm="LIVE555 Streaming Media", nonce="61edcd2e69a2a5bc6e945cca58016197", uri="rtsp://ispy:554/live/profile.0
", response="8d2134a46c3e4f6e0b1d4c6a0f04ab73", algorithm="MD5"
User-Agent: ZoneMinder/1.35.20
CSeq: 5

]
03/11/21 09:19:29.563157 zmc_m10[2655335].DB2-zm_rtsp.cpp/63 [Received RTSP response: $^A (2 bytes)]
03/11/21 09:19:29.563213 zmc_m10[2655335].ERR-zm_rtsp.cpp/71 [Response parse failure, 2 bytes follow]
03/11/21 09:19:29.563298 zmc_m10[2655335].ERR-zm_rtsp.cpp/73 [2: 24 01]

```

Tcpdump of the monitor session, from the "PLAY" command:
```
09:19:29.561383 IP 192.168.88.252.52924 > 192.168.88.220.554: Flags [P.], seq 843:1185, ack 1504, win 501, options [nop,nop,TS val 2225334302 ecr 1237
45], length 342: RTSP: PLAY rtsp://ispy:554/live/profile.0 RTSP/1.0
        0x0000:  4500 018a d752 4000 4006 2ef2 c0a8 58fc  E....R@.@.....X.
        0x0010:  c0a8 58dc cebc 022a d4ca 6989 2acd b5f1  ..X....*..i.*...
        0x0020:  8018 01f5 34a6 0000 0101 080a 84a3 e81e  ....4........... 
        0x0030:  0001 e361 504c 4159 2072 7473 703a 2f2f  ...aPLAY.rtsp://
        0x0040:  6973 7079 3a35 3534 2f6c 6976 652f 7072  ispy:554/live/pr
        0x0050:  6f66 696c 652e 3020 5254 5350 2f31 2e30  ofile.0.RTSP/1.0
        0x0060:  0d0a 5365 7373 696f 6e3a 2041 4237 4635  ..Session:.AB7F5
        0x0070:  3139 360d 0a52 616e 6765 3a20 6e70 743d  196..Range:.npt=
        0x0080:  302e 3030 302d 0d0a 4175 7468 6f72 697a  0.000-..Authoriz
        0x0090:  6174 696f 6e3a 2044 6967 6573 7420 7573  ation:.Digest.us
        0x00a0:  6572 6e61 6d65 3d22 6164 6d69 6e22 2c20  ername="admin",.
        0x00b0:  7265 616c 6d3d 224c 4956 4535 3535 2053  realm="LIVE555.S
        0x00c0:  7472 6561 6d69 6e67 204d 6564 6961 222c  treaming.Media",
        0x00d0:  206e 6f6e 6365 3d22 3631 6564 6364 3265  .nonce="61edcd2e
        0x00e0:  3639 6132 6135 6263 3665 3934 3563 6361  69a2a5bc6e945cca
        0x00f0:  3538 3031 3631 3937 222c 2075 7269 3d22  58016197",.uri="
        0x0100:  7274 7370 3a2f 2f69 7370 793a 3535 342f  rtsp://ispy:554/
        0x0110:  6c69 7665 2f70 726f 6669 6c65 2e30 222c  live/profile.0",
        0x0120:  2072 6573 706f 6e73 653d 2238 6432 3133  .response="8d213
        0x0130:  3461 3436 6333 6534 6636 6530 6231 6434  4a46c3e4f6e0b1d4
        0x0140:  6336 6130 6630 3461 6237 3322 2c20 616c  c6a0f04ab73",.al
        0x0150:  676f 7269 7468 6d3d 224d 4435 220d 0a55  gorithm="MD5"..U
        0x0160:  7365 722d 4167 656e 743a 205a 6f6e 654d  ser-Agent:.ZoneM
        0x0170:  696e 6465 722f 312e 3335 2e32 300d 0a43  inder/1.35.20..C
        0x0180:  5365 713a 2035 0d0a 0d0a                 Seq:.5....
09:19:29.563114 IP 192.168.88.220.554 > 192.168.88.252.52924: Flags [P.], seq 1504:1508, ack 1185, win 1106, options [nop,nop,TS val 123746 ecr 222533
4302], length 4: RTSP
        0x0000:  4500 0038 534f 4000 4006 b447 c0a8 58dc  E..8SO@.@..G..X.
        0x0010:  c0a8 58fc 022a cebc 2acd b5f1 d4ca 6adf  ..X..*..*.....j.
        0x0020:  8018 0452 d98e 0000 0101 080a 0001 e362  ...R...........b
        0x0030:  84a3 e81e 2401 0030                      ....$..0
09:19:29.603253 IP 192.168.88.252.52924 > 192.168.88.220.554: Flags [.], ack 1508, win 501, options [nop,nop,TS val 2225334344 ecr 123746], length 0
        0x0000:  4500 0034 d753 4000 4006 3047 c0a8 58fc  E..4.S@.@.0G..X.
        0x0010:  c0a8 58dc cebc 022a d4ca 6adf 2acd b5f5  ..X....*..j.*...
        0x0020:  8010 01f5 3350 0000 0101 080a 84a3 e848  ....3P.........H
        0x0030:  0001 e362                                ...b
09:19:29.603831 IP 192.168.88.220.554 > 192.168.88.252.52924: Flags [P.], seq 1508:1897, ack 1185, win 1106, options [nop,nop,TS val 123756 ecr 222533
4344], length 389: RTSP
        0x0000:  4500 01b9 5350 4000 4006 b2c5 c0a8 58dc  E...SP@.@.....X.
        0x0010:  c0a8 58fc 022a cebc 2acd b5f5 d4ca 6adf  ..X..*..*.....j.
        0x0020:  8018 0452 81db 0000 0101 080a 0001 e36c  ...R...........l
        0x0030:  84a3 e848 80c8 0006 9ee4 66ec e3f3 c470  ...H......f....p
        0x0040:  430c dc87 be8f b021 0000 0000 0000 0000  C......!........
        0x0050:  81ca 0004 9ee4 66ec 0106 286e 6f6e 6529  ......f...(none)
        0x0060:  0000 0000 5254 5350 2f31 2e30 2032 3030  ....RTSP/1.0.200
        0x0070:  204f 4b0d 0a43 5365 713a 2035 0d0a 4461  .OK..CSeq:.5..Da
        0x0080:  7465 3a20 5765 642c 204d 6172 2031 3020  te:.Wed,.Mar.10.
        0x0090:  3230 3231 2032 323a 3139 3a32 3820 474d  2021.22:19:28.GM
        0x00a0:  540d 0a52 616e 6765 3a20 6e70 743d 302e  T..Range:.npt=0.
        0x00b0:  3030 302d 0d0a 5365 7373 696f 6e3a 2041  000-..Session:.A
        0x00c0:  4237 4635 3139 360d 0a52 5450 2d49 6e66  B7F5196..RTP-Inf
        0x00d0:  6f3a 2075 726c 3d72 7473 703a 2f2f 3a3a  o:.url=rtsp://::
        0x00e0:  6666 6666 3a31 3932 2e31 3638 2e38 382e  ffff:192.168.88.
        0x00f0:  3232 302f 6c69 7665 2f70 726f 6669 6c65  220/live/profile
        0x0100:  2e30 2f76 6964 656f 3b73 6571 3d33 3132  .0/video;seq=312
        0x0110:  3630 3b72 7470 7469 6d65 3d33 3139 3730  60;rtptime=31970
        0x0120:  3837 3830 372c 7572 6c3d 7274 7370 3a2f  87807,url=rtsp:/
        0x0130:  2f3a 3a66 6666 663a 3139 322e 3136 382e  /::ffff:192.168.
        0x0140:  3838 2e32 3230 2f6c 6976 652f 7072 6f66  88.220/live/prof
        0x0150:  696c 652e 302f 6175 6469 6f3b 7365 713d  ile.0/audio;seq=
        0x0160:  303b 7274 7074 696d 653d 302c 7572 6c3d  0;rtptime=0,url=
        0x0170:  7274 7370 3a2f 2f3a 3a66 6666 663a 3139  rtsp://::ffff:19
        0x0180:  322e 3136 382e 3838 2e32 3230 2f6c 6976  2.168.88.220/liv
        0x0190:  652f 7072 6f66 696c 652e 302f 6175 6469  e/profile.0/audi
        0x01a0:  6f62 6163 6b3b 7365 713d 303b 7274 7074  oback;seq=0;rtpt
        0x01b0:  696d 653d 300d 0a0d 0a                   ime=0....
```
The logged "[Response parse failure, 2 bytes follow] [2: 24 01]" relates to the packet received from the camera immediately after the PLAY command:
```
09:19:29.563114 IP 192.168.88.220.554 > 192.168.88.252.52924: Flags [P.], seq 1504:1508, ack 1185, win 1106, options [nop,nop,TS val 123746 ecr 222533
4302], length 4: RTSP
        0x0000:  4500 0038 534f 4000 4006 b447 c0a8 58dc  E..8SO@.@..G..X.
        0x0010:  c0a8 58fc 022a cebc 2acd b5f1 d4ca 6adf  ..X..*..*.....j.
        0x0020:  8018 0452 d98e 0000 0101 080a 0001 e362  ...R...........b
        0x0030:  84a3 e81e 2401 0030                      ....$..0
```
Note the first byte of the unrecognized response is "$": this seems to be [RFC 2326 - 10.12 Embedded (Interleaved) Binary Data](https://tools.ietf.org/html/rfc2326#page-40).

For comparison, `ffplay` sees the same response but doesn't have a problem, per this tcpdump extract:
```
09:14:44.652720 IP 192.168.88.252.52784 > 192.168.88.220.554: Flags [P.], seq 1665:2013, ack 1966, win 501, options [nop,nop,TS val 2225049394 ecr 52515], length 348: RTSP: PLAY rtsp://::ffff:192.168.88.220/live/profile.0/ RTSP/1.0
        0x0000:  4500 0190 3a85 4000 4006 cbb9 c0a8 58fc  E...:.@.@.....X.
        0x0010:  c0a8 58dc ce30 022a 3ffd 015a 2397 a53d  ..X..0.*?..Z#..=
        0x0020:  8018 01f5 34ac 0000 0101 080a 849f 8f32  ....4..........2
        0x0030:  0000 cd23 504c 4159 2072 7473 703a 2f2f  ...#PLAY.rtsp://
        0x0040:  3a3a 6666 6666 3a31 3932 2e31 3638 2e38  ::ffff:192.168.8
        0x0050:  382e 3232 302f 6c69 7665 2f70 726f 6669  8.220/live/profi
        0x0060:  6c65 2e30 2f20 5254 5350 2f31 2e30 0d0a  le.0/.RTSP/1.0..
        0x0070:  5261 6e67 653a 206e 7074 3d30 2e30 3030  Range:.npt=0.000
        0x0080:  2d0d 0a43 5365 713a 2037 0d0a 5573 6572  -..CSeq:.7..User
        0x0090:  2d41 6765 6e74 3a20 4c61 7666 3538 2e32  -Agent:.Lavf58.2
        0x00a0:  392e 3130 300d 0a53 6573 7369 6f6e 3a20  9.100..Session:.
        0x00b0:  3632 3133 3546 3838 0d0a 4175 7468 6f72  62135F88..Author
        0x00c0:  697a 6174 696f 6e3a 2044 6967 6573 7420  ization:.Digest.
        0x00d0:  7573 6572 6e61 6d65 3d22 6164 6d69 6e22  username="admin"
        0x00e0:  2c20 7265 616c 6d3d 224c 4956 4535 3535  ,.realm="LIVE555
        0x00f0:  2053 7472 6561 6d69 6e67 204d 6564 6961  .Streaming.Media
        0x0100:  222c 206e 6f6e 6365 3d22 6662 6434 3930  ",.nonce="fbd490
        0x0110:  6533 6463 6565 3666 3763 6633 3832 3335  e3dcee6f7cf38235
        0x0120:  6434 3361 6166 6637 3235 222c 2075 7269  d43aaff725",.uri
        0x0130:  3d22 7274 7370 3a2f 2f3a 3a66 6666 663a  ="rtsp://::ffff:
        0x0140:  3139 322e 3136 382e 3838 2e32 3230 2f6c  192.168.88.220/l
        0x0150:  6976 652f 7072 6f66 696c 652e 302f 222c  ive/profile.0/",
        0x0160:  2072 6573 706f 6e73 653d 2238 3535 3264  .response="8552d
        0x0170:  3433 3137 6565 3137 6264 6432 3137 6264  4317ee17bdd217bd
        0x0180:  3363 3265 3365 6237 6430 3722 0d0a 0d0a  3c2e3eb7d07"....
09:14:44.654341 IP 192.168.88.220.554 > 192.168.88.252.52784: Flags [P.], seq 1966:1970, ack 2013, win 1240, options [nop,nop,TS val 52516 ecr 2225049394], length 4: RTSP
        0x0000:  4500 0038 5119 4000 4006 b67d c0a8 58dc  E..8Q.@.@..}..X.
        0x0010:  c0a8 58fc 022a ce30 2397 a53d 3ffd 02b6  ..X..*.0#..=?...
        0x0020:  8018 04d8 5da5 0000 0101 080a 0000 cd24  ....]..........$
        0x0030:  849f 8f32 2401 0030                      ...2$..0
09:14:44.695318 IP 192.168.88.252.52784 > 192.168.88.220.554: Flags [.], ack 1970, win 501, options [nop,nop,TS val 2225049436 ecr 52516], length 0
        0x0000:  4500 0034 3a86 4000 4006 cd14 c0a8 58fc  E..4:.@.@.....X.
        0x0010:  c0a8 58dc ce30 022a 3ffd 02b6 2397 a541  ..X..0.*?...#..A
        0x0020:  8010 01f5 3350 0000 0101 080a 849f 8f5c  ....3P.........\
        0x0030:  0000 cd24                                ...$
09:14:44.695968 IP 192.168.88.220.554 > 192.168.88.252.52784: Flags [P.], seq 1970:2455, ack 2013, win 1240, options [nop,nop,TS val 52526 ecr 2225049436], length 485: RTSP
        0x0000:  4500 0219 511a 4000 4006 b49b c0a8 58dc  E...Q.@.@.....X.
        0x0010:  c0a8 58fc 022a ce30 2397 a541 3ffd 02b6  ..X..*.0#..A?...
        0x0020:  8018 04d8 a207 0000 0101 080a 0000 cd2e  ................
        0x0030:  849f 8f5c 80c8 0006 5ac4 8c4e e3f3 c353  ...\....Z..N...S
        0x0040:  57c8 e25d a3de 23bf 0000 0000 0000 0000  W..]..#.........
        0x0050:  81ca 0004 5ac4 8c4e 0106 286e 6f6e 6529  ....Z..N..(none)
        0x0060:  0000 0000 2403 0030 80c8 0006 41b8 fc73  ....$..0....A..s
        0x0070:  e3f3 c353 57f1 f9ad 0db3 8067 0000 0000  ...SW......g....
        0x0080:  0000 0000 81ca 0004 41b8 fc73 0106 286e  ........A..s..(n
        0x0090:  6f6e 6529 0000 0000 2405 001c 80c9 0001  one)....$.......
        0x00a0:  29da 2b5e 81ca 0004 29da 2b5e 0106 286e  ).+^....).+^..(n
        0x00b0:  6f6e 6529 0000 0000 5254 5350 2f31 2e30  one)....RTSP/1.0
        0x00c0:  2032 3030 204f 4b0d 0a43 5365 713a 2037  .200.OK..CSeq:.7
        0x00d0:  0d0a 4461 7465 3a20 5765 642c 204d 6172  ..Date:.Wed,.Mar
        0x00e0:  2031 3020 3230 3231 2032 323a 3134 3a34  .10.2021.22:14:4
        0x00f0:  3320 474d 540d 0a52 616e 6765 3a20 6e70  3.GMT..Range:.np
        0x0100:  743d 302e 3030 302d 0d0a 5365 7373 696f  t=0.000-..Sessio
        0x0110:  6e3a 2036 3231 3335 4638 380d 0a52 5450  n:.62135F88..RTP
        0x0120:  2d49 6e66 6f3a 2075 726c 3d72 7473 703a  -Info:.url=rtsp:
        0x0130:  2f2f 3a3a 6666 6666 3a31 3932 2e31 3638  //::ffff:192.168
        0x0140:  2e38 382e 3232 302f 6c69 7665 2f70 726f  .88.220/live/pro
        0x0150:  6669 6c65 2e30 2f76 6964 656f 3b73 6571  file.0/video;seq
        0x0160:  3d32 3439 3533 3b72 7470 7469 6d65 3d32  =24953;rtptime=2
        0x0170:  3734 3932 3434 3338 362c 7572 6c3d 7274  749244386,url=rt
        0x0180:  7370 3a2f 2f3a 3a66 6666 663a 3139 322e  sp://::ffff:192.
        0x0190:  3136 382e 3838 2e32 3230 2f6c 6976 652f  168.88.220/live/
        0x01a0:  7072 6f66 696c 652e 302f 6175 6469 6f3b  profile.0/audio;
        0x01b0:  7365 713d 3335 3638 343b 7274 7074 696d  seq=35684;rtptim
        0x01c0:  653d 3232 3938 3637 3632 332c 7572 6c3d  e=229867623,url=
        0x01d0:  7274 7370 3a2f 2f3a 3a66 6666 663a 3139  rtsp://::ffff:19
        0x01e0:  322e 3136 382e 3838 2e32 3230 2f6c 6976  2.168.88.220/liv
        0x01f0:  652f 7072 6f66 696c 652e 302f 6175 6469  e/profile.0/audi
        0x0200:  6f62 6163 6b3b 7365 713d 303b 7274 7074  oback;seq=0;rtpt
        0x0210:  696d 653d 300d 0a0d 0a                   ime=0....
```

**Expected behavior**
The monitor plays

**Comment by connortechnology** [comment]
Have you thought about trying the ffmpeg monitor type?  We actually don't plan to continue support for the remote type.

**Comment by chrisrd** [comment]
Huh. Didn't realise that was an option, was thinking that was only for local cameras or something (complete newbie here).

...yep, that works, using:

```
General
   Source Type:  Ffmpeg
   Function:  Monitor
Source
   Source Path:  rtsp://admin:pin@ip:554/live/profile.0
```

Tks!

**Comment by chrisrd** [comment]
Closing - given this is an issue with the remote monitor type which is going to go away
